[
  {
    "id": "youtube:ALeWM4ROM54",
    "ts": "2026-09-24T16:01:00.056319Z",
    "source": "youtube",
    "role": "demand",
    "kind": "other",
    "url": "https://www.youtube.com/watch?v=ALeWM4ROM54",
    "product_key": null,
    "tags": [
      "cover",
      "display",
      "power",
      "rad",
      "youtube"
    ],
    "summary": "Which is better, EggRider or 35 Amp Controller &amp; Display for your Rad Power Bike (Update) (Big Game Bikes)",
    "quote": "Find out more about these products here: Eggrider - http://bit.ly/BGBEggrider 35 Amp controller and Display ...",
    "metrics": {
      "matched_keywords": [
        "Rad Power display cover"
      ],
      "channel_title": "Big Game Bikes",
      "published_at": "2021-02-23T19:00:02Z",
      "video_id": "ALeWM4ROM54"
    },
    "raw_ref": "https://www.youtube.com/watch?v=ALeWM4ROM54"
  },
  {
    "id": "youtube:IRvq8QfFOlU",
    "ts": "2026-09-24T16:01:00.056319Z",
    "source": "youtube",
    "role": "demand",
    "kind": "other",
    "url": "https://www.youtube.com/watch?v=IRvq8QfFOlU",
    "product_key": null,
    "tags": [
      "cover",
      "display",
      "power",
      "rad",
      "youtube"
    ],
    "summary": "LCD Display Features | Rad Tech (Rad Power Bikes)",
    "quote": "A step-by-step guide on the features and operation of the Rad Power Bikes LCD Display. If you have more tech questions, feel ...",
    "metrics": {
      "matched_keywords": [
        "Rad Power display cover"
      ],
      "channel_title": "Rad Power Bikes",
      "published_at": "2018-03-28T22:38:30Z",
      "video_id": "IRvq8QfFOlU"
    },
    "raw_ref": "https://www.youtube.com/watch?v=IRvq8QfFOlU"
  },
  {
    "id": "youtube:mZmgdVQBcZY",
    "ts": "2026-09-24T16:01:00.056319Z",
    "source": "youtube",
    "role": "demand",
    "kind": "other",
    "url": "https://www.youtube.com/watch?v=mZmgdVQBcZY",
    "product_key": null,
    "tags": [
      "cover",
      "display",
      "power",
      "rad",
      "youtube"
    ],
    "summary": "Radpower EBike Performance Mods - Radrunner Part 1 (Controller Upgrade) (Electric Bike Laboratory)",
    "quote": "Thanks for checking out the channel! This is part 1 of 3 of our RadRunner modification series. Enjoy!! Radrunner Upgrade Parts: ...",
    "metrics": {
      "matched_keywords": [
        "Rad Power display cover"
      ],
      "channel_title": "Electric Bike Laboratory",
      "published_at": "2024-11-02T18:00:25Z",
      "video_id": "mZmgdVQBcZY"
    },
    "raw_ref": "https://www.youtube.com/watch?v=mZmgdVQBcZY"
  },
  {
    "id": "youtube:aniVBeHukYQ",
    "ts": "2026-09-24T16:01:00.056319Z",
    "source": "youtube",
    "role": "demand",
    "kind": "other",
    "url": "https://www.youtube.com/watch?v=aniVBeHukYQ",
    "product_key": null,
    "tags": [
      "bike",
      "cover",
      "display",
      "e",
      "power",
      "rad",
      "youtube"
    ],
    "summary": "Rad Power Bikes Rad Rover : Digital Display Troubleshoot (T2 da Bike Guy)",
    "quote": "Rad Power Bikes Rad Rover Digital Display Failure would not allow the Rad Rover to Power up so we swapped out displays to ...",
    "metrics": {
      "matched_keywords": [
        "Rad Power display cover",
        "Rad e-bike display cover"
      ],
      "channel_title": "T2 da Bike Guy",
      "published_at": "2022-06-27T18:20:45Z",
      "video_id": "aniVBeHukYQ"
    },
    "raw_ref": "https://www.youtube.com/watch?v=aniVBeHukYQ"
  },
  {
    "id": "youtube:599Cq6L7DkE",
    "ts": "2026-09-24T16:01:00.056319Z",
    "source": "youtube",
    "role": "demand",
    "kind": "other",
    "url": "https://www.youtube.com/watch?v=599Cq6L7DkE",
    "product_key": null,
    "tags": [
      "cover",
      "display",
      "power",
      "rad",
      "youtube"
    ],
    "summary": "Step by Step: Rad Power Bikes&#39; New Color LCD Display on the Radster Trail and Radster Road (Ebike Escape)",
    "quote": "This is what the new LCD display looks like on the Rad Power Bikes Radster Trail and Radster Road. In the advanced settings ...",
    "metrics": {
      "matched_keywords": [
        "Rad Power display cover"
      ],
      "channel_title": "Ebike Escape",
      "published_at": "2024-05-28T18:44:47Z",
      "video_id": "599Cq6L7DkE"
    },
    "raw_ref": "https://www.youtube.com/watch?v=599Cq6L7DkE"
  },
  {
    "id": "youtube:oOQDjJcHok0",
    "ts": "2026-09-24T16:01:00.056319Z",
    "source": "youtube",
    "role": "demand",
    "kind": "other",
    "url": "https://www.youtube.com/watch?v=oOQDjJcHok0",
    "product_key": null,
    "tags": [
      "bike",
      "cover",
      "display",
      "e",
      "rad",
      "youtube"
    ],
    "summary": "Rad Cover for Rad E-Bike Display (RadPaul)",
    "quote": "This cover will help keep water off the top of your display during wet conditions. The view is anti-glare plexiglass.",
    "metrics": {
      "matched_keywords": [
        "Rad e-bike display cover"
      ],
      "channel_title": "RadPaul",
      "published_at": "2019-12-23T19:48:29Z",
      "video_id": "oOQDjJcHok0"
    },
    "raw_ref": "https://www.youtube.com/watch?v=oOQDjJcHok0"
  },
  {
    "id": "youtube:Hd0_zuwhgFg",
    "ts": "2026-09-24T16:01:00.056319Z",
    "source": "youtube",
    "role": "demand",
    "kind": "other",
    "url": "https://www.youtube.com/watch?v=Hd0_zuwhgFg",
    "product_key": null,
    "tags": [
      "bike",
      "cover",
      "display",
      "e",
      "rad",
      "youtube"
    ],
    "summary": "RAD E-Bike Display Cover In Orange Color (RadPaul)",
    "quote": "Make you RAD just a little bit more RAD and added protection from the environment. Easy on easy off with Velcro mounting to ...",
    "metrics": {
      "matched_keywords": [
        "Rad e-bike display cover"
      ],
      "channel_title": "RadPaul",
      "published_at": "2019-12-29T18:47:05Z",
      "video_id": "Hd0_zuwhgFg"
    },
    "raw_ref": "https://www.youtube.com/watch?v=Hd0_zuwhgFg"
  },
  {
    "id": "youtube:52RTeyz9FUI",
    "ts": "2026-09-24T16:01:00.056319Z",
    "source": "youtube",
    "role": "demand",
    "kind": "complaint",
    "url": "https://www.youtube.com/watch?v=52RTeyz9FUI",
    "product_key": null,
    "tags": [
      "bike",
      "cover",
      "display",
      "e",
      "rad",
      "youtube"
    ],
    "summary": "sunlid for the RadPaul Covers for RAD E-Bike LCD displays (RadPaul)",
    "quote": "An option to add to the RadPaul LCD covers for Rad E-bike LCD covers at ...",
    "metrics": {
      "matched_keywords": [
        "Rad e-bike display cover"
      ],
      "channel_title": "RadPaul",
      "published_at": "2020-05-02T19:58:17Z",
      "video_id": "52RTeyz9FUI"
    },
    "raw_ref": "https://www.youtube.com/watch?v=52RTeyz9FUI"
  },
  {
    "id": "youtube:V_IjONi7rvs",
    "ts": "2026-09-24T16:01:00.056319Z",
    "source": "youtube",
    "role": "demand",
    "kind": "other",
    "url": "https://www.youtube.com/watch?v=V_IjONi7rvs",
    "product_key": null,
    "tags": [
      "bike",
      "cover",
      "display",
      "e",
      "rad",
      "youtube"
    ],
    "summary": "3D Print Rad Ebike Display Screen Cover #SHORTS - Florida Fish Hunter (FFH TV)",
    "quote": "Playing around with my new Rad Ebike that I got for my birthday - I felt like it needed something to protect my display screen when ...",
    "metrics": {
      "matched_keywords": [
        "Rad e-bike display cover"
      ],
      "channel_title": "FFH TV",
      "published_at": "2021-11-25T01:47:09Z",
      "video_id": "V_IjONi7rvs"
    },
    "raw_ref": "https://www.youtube.com/watch?v=V_IjONi7rvs"
  },
  {
    "id": "youtube:PLkCct1Oa80",
    "ts": "2026-09-24T16:01:00.056319Z",
    "source": "youtube",
    "role": "demand",
    "kind": "other",
    "url": "https://www.youtube.com/watch?v=PLkCct1Oa80",
    "product_key": null,
    "tags": [
      "mount",
      "phone",
      "power",
      "rad",
      "radrunner",
      "youtube"
    ],
    "summary": "Rad Power RadRunner 1 Phone Mount Install  ----Quick Install of 15.99 Phone Mount. Budget Ebike (Frugal Panda's Travels & Reviews)",
    "quote": "Amazon Link Below: https://amzn.to/3cHqoZB Rad Power RadRunner EV bike Phone Mount install. Anti-Shake Bike Phone Mount ...",
    "metrics": {
      "matched_keywords": [
        "RadRunner phone mount",
        "Rad Power phone mount"
      ],
      "channel_title": "Frugal Panda's Travels & Reviews",
      "published_at": "2020-05-18T06:05:41Z",
      "video_id": "PLkCct1Oa80"
    },
    "raw_ref": "https://www.youtube.com/watch?v=PLkCct1Oa80"
  },
  {
    "id": "youtube:AvDCigM7_BE",
    "ts": "2026-09-24T16:01:00.056319Z",
    "source": "youtube",
    "role": "demand",
    "kind": "other",
    "url": "https://www.youtube.com/watch?v=AvDCigM7_BE",
    "product_key": null,
    "tags": [
      "mount",
      "phone",
      "radrunner",
      "youtube"
    ],
    "summary": "#Radrunner #ebike phone holder install (Mike's flavor and fixes)",
    "quote": "#Radrunner #ebike phone holder install",
    "metrics": {
      "matched_keywords": [
        "RadRunner phone mount"
      ],
      "channel_title": "Mike's flavor and fixes",
      "published_at": "2023-09-22T23:23:34Z",
      "video_id": "AvDCigM7_BE"
    },
    "raw_ref": "https://www.youtube.com/watch?v=AvDCigM7_BE"
  },
  {
    "id": "youtube:DOyBI_x4dkw",
    "ts": "2026-09-24T16:01:00.056319Z",
    "source": "youtube",
    "role": "demand",
    "kind": "other",
    "url": "https://www.youtube.com/watch?v=DOyBI_x4dkw",
    "product_key": null,
    "tags": [
      "mount",
      "phone",
      "radrunner",
      "youtube"
    ],
    "summary": "Rad Power Bikes RadRunner Accessories: passenger seat, mirrors phone mount, and more! (Ebike Escape)",
    "quote": "RadRunner Accessories: https://ebikeescape.com/radrunner-accessories/ Rad Power Bikes: ...",
    "metrics": {
      "matched_keywords": [
        "RadRunner phone mount"
      ],
      "channel_title": "Ebike Escape",